[
{"station_id": "devyatkino", "ts": "2026-11-12T05:00:00+03:00", "horizon_min": 60, "q10": 766, "q50": 901, "q90": 1036, "baseline": 935, "is_anomaly": false, "model_version": "stub_v1"},
{"station_id": "devyatkino", "ts": "2026-11-12T05:00:00+03:00", "horizon_min": 120, "q10": 776, "q50": 970, "q90": 1164, "baseline": 935, "is_anomaly": false, "model_version": "stub_v1"},
{"station_id": "devyatkino", "ts": "2026-11-12T06:00:00+03:00", "horizon_min": 60, "q10": 1046, "q50": 1230, "q90": 1415, "baseline": 1191, "is_anomaly": false, "model_version": "stub_v1"},
{"station_id": "devyatkino", "ts": "2026-11-12T06:00:00+03:00", "horizon_min": 120, "q10": 860, "q50": 1075, "q90": 1290, "baseline": 1191, "is_anomaly": false, "model_version": "stub_v1"},
{"station_id": "devyatkino", "ts": "2026-11-12T07:00:00+03:00", "horizon_min": 60, "q10": 2365, "q50": 2782, "q90": 3199, "baseline": 2915, "is_anomaly": false, "model_version": "stub_v1"},
{"station_id": "devyatkino", "ts": "2026-11-12T07:00:00+03:00", "horizon_min": 120, "q10": 2347, "q50": 2934, "q90": 3520, "baseline": 2915, "is_anomaly": false, "model_version": "stub_v1"},
{"station_id": "devyatkino", "ts": "2026-11-12T08:00:00+03:00", "horizon_min": 60, "q10": 5330, "q50": 6271, "q90": 7211, "baseline": 6341, "is_anomaly": false, "model_version": "stub_v1"},
{"station_id": "devyatkino", "ts": "2026-11-12T08:00:00+03:00", "horizon_min": 120, "q10": 5069, "q50": 6336, "q90": 7603, "baseline": 6341, "is_anomaly": false, "model_version": "stub_v1"},
{"station_id": "devyatkino", "ts": "2026-11-12T09:00:00+03:00", "horizon_min": 60, "q10": 5229, "q50": 6152, "q90": 7074, "baseline": 6341, "is_anomaly": false, "model_version": "stub_v1"},
{"station_id": "devyatkino", "ts": "2026-11-12T09:00:00+03:00", "horizon_min": 120, "q10": 5296, "q50": 6620, "q90": 7944, "baseline": 6341, "is_anomaly": false, "model_version": "stub_v1"},
{"station_id": "devyatkino", "ts": "2026-11-12T10:00:00+03:00", "horizon_min": 60, "q10": 2545, "q50": 2994, "q90": 3444, "baseline": 2915, "is_anomaly": false, "model_version": "stub_v1"},
{"station_id": "devyatkino", "ts": "2026-11-12T10:00:00+03:00", "horizon_min": 120, "q10": 2340, "q50": 2925, "q90": 3510, "baseline": 2915, "is_anomaly": false, "model_version": "stub_v1"},
{"station_id": "devyatkino", "ts": "2026-11-12T11:00:00+03:00", "horizon_min": 60, "q10": 1052, "q50": 1238, "q90": 1424, "baseline": 1191, "is_anomaly": false, "model_version": "stub_v1"},
{"station_id": "devyatkino", "ts": "2026-11-12T11:00:00+03:00", "horizon_min": 120, "q10": 975, "q50": 1219, "q90": 1463, "baseline": 1191, "is_anomaly": false, "model_version": "stub_v1"},
{"station_id": "devyatkino", "ts": "2026-11-12T12:00:00+03:00", "horizon_min": 60, "q10": 771, "q50": 907, "q90": 1043, "baseline": 935, "is_anomaly": false, "model_version": "stub_v1"},
{"station_id": "devyatkino", "ts": "2026-11-12T12:00:00+03:00", "horizon_min": 120, "q10": 762, "q50": 952, "q90": 1142, "baseline": 935, "is_anomaly": false, "model_version": "stub_v1"},
{"station_id": "devyatkino", "ts": "2026-11-12T13:00:00+03:00", "horizon_min": 60, "q10": 759, "q50": 893, "q90": 1027, "baseline": 924, "is_anomaly": false, "model_version": "stub_v1"},
{"station_id": "devyatkino", "ts": "2026-11-12T13:00:00+03:00", "horizon_min": 120, "q10": 772, "q50": 965, "q90": 1158, "baseline": 924, "is_anomaly": false, "model_version": "stub_v1"},
{"station_id": "devyatkino", "ts": "2026-11-12T14:00:00+03:00", "horizon_min": 60, "q10": 818, "q50": 963, "q90": 1107, "baseline": 964, "is_anomaly": false, "model_version": "stub_v1"},
{"station_id": "devyatkino", "ts": "2026-11-12T14:00:00+03:00", "horizon_min": 120, "q10": 764, "q50": 955, "q90": 1147, "baseline": 964, "is_anomaly": false, "model_version": "stub_v1"},
{"station_id": "devyatkino", "ts": "2026-11-12T15:00:00+03:00", "horizon_min": 60, "q10": 1049, "q50": 1234, "q90": 1419, "baseline": 1264, "is_anomaly": false, "model_version": "stub_v1"},
{"station_id": "devyatkino", "ts": "2026-11-12T15:00:00+03:00", "horizon_min": 120, "q10": 1073, "q50": 1341, "q90": 1609, "baseline": 1264, "is_anomaly": false, "model_version": "stub_v1"},
{"station_id": "devyatkino", "ts": "2026-11-12T16:00:00+03:00", "horizon_min": 60, "q10": 2051, "q50": 2413, "q90": 2775, "baseline": 2426, "is_anomaly": false, "model_version": "stub_v1"},
{"station_id": "devyatkino", "ts": "2026-11-12T16:00:00+03:00", "horizon_min": 120, "q10": 1899, "q50": 2374, "q90": 2849, "baseline": 2426, "is_anomaly": false, "model_version": "stub_v1"},
{"station_id": "devyatkino", "ts": "2026-11-12T17:00:00+03:00", "horizon_min": 60, "q10": 3842, "q50": 4520, "q90": 5198, "baseline": 4576, "is_anomaly": false, "model_version": "stub_v1"},
{"station_id": "devyatkino", "ts": "2026-11-12T17:00:00+03:00", "horizon_min": 120, "q10": 3758, "q50": 4698, "q90": 5637, "baseline": 4576, "is_anomaly": false, "model_version": "stub_v1"},
{"station_id": "devyatkino", "ts": "2026-11-12T18:00:00+03:00", "horizon_min": 60, "q10": 5023, "q50": 5909, "q90": 6795, "baseline": 5834, "is_anomaly": false, "model_version": "stub_v1"},
{"station_id": "devyatkino", "ts": "2026-11-12T18:00:00+03:00", "horizon_min": 120, "q10": 4764, "q50": 5955, "q90": 7146, "baseline": 5834, "is_anomaly": false, "model_version": "stub_v1"},
{"station_id": "devyatkino", "ts": "2026-11-12T19:00:00+03:00", "horizon_min": 60, "q10": 3948, "q50": 4645, "q90": 5342, "baseline": 4576, "is_anomaly": false, "model_version": "stub_v1"},
{"station_id": "devyatkino", "ts": "2026-11-12T19:00:00+03:00", "horizon_min": 120, "q10": 4053, "q50": 5066, "q90": 6079, "baseline": 4576, "is_anomaly": false, "model_version": "stub_v1"},
{"station_id": "devyatkino", "ts": "2026-11-12T20:00:00+03:00", "horizon_min": 60, "q10": 2033, "q50": 2391, "q90": 2750, "baseline": 2426, "is_anomaly": false, "model_version": "stub_v1"},
{"station_id": "devyatkino", "ts": "2026-11-12T20:00:00+03:00", "horizon_min": 120, "q10": 1891, "q50": 2364, "q90": 2836, "baseline": 2426, "is_anomaly": false, "model_version": "stub_v1"},
{"station_id": "devyatkino", "ts": "2026-11-12T21:00:00+03:00", "horizon_min": 60, "q10": 1044, "q50": 1228, "q90": 1412, "baseline": 1264, "is_anomaly": false, "model_version": "stub_v1"},
{"station_id": "devyatkino", "ts": "2026-11-12T21:00:00+03:00", "horizon_min": 120, "q10": 1042, "q50": 1303, "q90": 1563, "baseline": 1264, "is_anomaly": false, "model_version": "stub_v1"},
{"station_id": "devyatkino", "ts": "2026-11-12T22:00:00+03:00", "horizon_min": 60, "q10": 852, "q50": 1003, "q90": 1153, "baseline": 964, "is_anomaly": false, "model_version": "stub_v1"},
{"station_id": "devyatkino", "ts": "2026-11-12T22:00:00+03:00", "horizon_min": 120, "q10": 767, "q50": 959, "q90": 1151, "baseline": 964, "is_anomaly": false, "model_version": "stub_v1"},
{"station_id": "devyatkino", "ts": "2026-11-12T23:00:00+03:00", "horizon_min": 60, "q10": 762, "q50": 897, "q90": 1032, "baseline": 924, "is_anomaly": false, "model_version": "stub_v1"},
{"station_id": "devyatkino", "ts": "2026-11-12T23:00:00+03:00", "horizon_min": 120, "q10": 709, "q50": 886, "q90": 1063, "baseline": 924, "is_anomaly": false, "model_version": "stub_v1"},
{"station_id": "devyatkino", "ts": "2026-11-13T00:00:00+03:00", "horizon_min": 60, "q10": 801, "q50": 942, "q90": 1084, "baseline": 921, "is_anomaly": false, "model_version": "stub_v1"},
{"station_id": "devyatkino", "ts": "2026-11-13T00:00:00+03:00", "horizon_min": 120, "q10": 764, "q50": 956, "q90": 1147, "baseline": 921, "is_anomaly": false, "model_version": "stub_v1"},
{"station_id": "grazhdansky_prospekt", "ts": "2026-11-12T05:00:00+03:00", "horizon_min": 60, "q10": 802, "q50": 944, "q90": 1085, "baseline": 984, "is_anomaly": false, "model_version": "stub_v1"},
{"station_id": "grazhdansky_prospekt", "ts": "2026-11-12T05:00:00+03:00", "horizon_min": 120, "q10": 809, "q50": 1011, "q90": 1213, "baseline": 984, "is_anomaly": false, "model_version": "stub_v1"},
{"station_id": "grazhdansky_prospekt", "ts": "2026-11-12T06:00:00+03:00", "horizon_min": 60, "q10": 1041, "q50": 1225, "q90": 1409, "baseline": 1254, "is_anomaly": false, "model_version": "stub_v1"},
{"station_id": "grazhdansky_prospekt", "ts": "2026-11-12T06:00:00+03:00", "horizon_min": 120, "q10": 1015, "q50": 1269, "q90": 1523, "baseline": 1254, "is_anomaly": false, "model_version": "stub_v1"},
{"station_id": "grazhdansky_prospekt", "ts": "2026-11-12T07:00:00+03:00", "horizon_min": 60, "q10": 2620, "q50": 3082, "q90": 3544, "baseline": 3070, "is_anomaly": false, "model_version": "stub_v1"},
{"station_id": "grazhdansky_prospekt", "ts": "2026-11-12T07:00:00+03:00", "horizon_min": 120, "q10": 2483, "q50": 3103, "q90": 3724, "baseline": 3070, "is_anomaly": false, "model_version": "stub_v1"},
{"station_id": "grazhdansky_prospekt", "ts": "2026-11-12T08:00:00+03:00", "horizon_min": 60, "q10": 5849, "q50": 6881, "q90": 7913, "baseline": 6677, "is_anomaly": false, "model_version": "stub_v1"},
{"station_id": "grazhdansky_prospekt", "ts": "2026-11-12T08:00:00+03:00", "horizon_min": 120, "q10": 5402, "q50": 6752, "q90": 8102, "baseline": 6677, "is_anomaly": false, "model_version": "stub_v1"},
{"station_id": "grazhdansky_prospekt", "ts": "2026-11-12T09:00:00+03:00", "horizon_min": 60, "q10": 5811, "q50": 6836, "q90": 7861, "baseline": 6677, "is_anomaly": false, "model_version": "stub_v1"},
{"station_id": "grazhdansky_prospekt", "ts": "2026-11-12T09:00:00+03:00", "horizon_min": 120, "q10": 5360, "q50": 6700, "q90": 8040, "baseline": 6677, "is_anomaly": false, "model_version": "stub_v1"},
{"station_id": "grazhdansky_prospekt", "ts": "2026-11-12T10:00:00+03:00", "horizon_min": 60, "q10": 2636, "q50": 3101, "q90": 3566, "baseline": 3070, "is_anomaly": false, "model_version": "stub_v1"},
{"station_id": "grazhdansky_prospekt", "ts": "2026-11-12T10:00:00+03:00", "horizon_min": 120, "q10": 2533, "q50": 3167, "q90": 3800, "baseline": 3070, "is_anomaly": false, "model_version": "stub_v1"},